### ISSUE TITLE
lightway-laser - Tun on server not going active

### ISSUE THREAD

**Issue by light-brite** [expressvpn/lightway-core#8]
After compiling and running on latest patched Centos 8 image I attempted to utilize the reference package of lightway-laser for a client/server test but ran into an issue when trying to run the most basic tests as documented: 
https://github.com/expressvpn/lightway-laser

## Expected Behavior
After bringing up the client and server on two different VMs I was expecting a valid IP address and Tun interface on both to go up/active.  
Client device = wolfssl-01
Server device = wolfssl-02

## Current Behavior
From basic debugging the client appears to be functional from a network standpoint and is receiving an IP address from the server: 

Startup: 
> sudo ./lw.out --client --protocol udp --username test --password test --server_ip '192.168.0.49' --server_port 19655 --cert shared.crt --tun helium-test
[18:50:44.725344s] Starting client...
[18:50:44.725425s] Connecting to:        192.168.0.49:19655
[18:50:44.725432s] Username:             test
[18:50:44.725435s] Client cert:          shared.crt
[18:50:44.725438s] Streaming Mode:       false
[18:50:44.725442s] Tun device:           helium-test

> 5: helium-test: <POINTOPOINT,MULTICAST,NOARP,UP,LOWER_UP> mtu 1350 qdisc fq_codel state UNKNOWN group default qlen 500
    link/none 
    inet 10.125.0.2 peer 10.125.0.1/32 scope global helium-test
       valid_lft forever preferred_lft forever
    inet6 fe80::f61a:8c2d:7a82:e292/64 scope link stable-privacy 
       valid_lft forever preferred_lft forever

The client device is also properly updating the route table:

> 10.125.0.1 dev helium-test proto kernel scope link src 10.125.0.2

The server shows a different behavior where the server appears to be starting properly: 

>  sudo ./lw.out --server --protocol udp --username test --password test --server_ip '0.0.0.0' --server_port 19655 --cert shared.crt --key server.key --tun helium-test
[18:58:51.001022s] Starting server...
[18:58:51.001105s] Listening on:         0.0.0.0:19655
[18:58:51.001111s] Username:             test
[18:58:51.001115s] Server cert:          shared.crt
[18:58:51.001118s] Server key:           server.key
[18:58:51.001121s] Streaming Mode:       false
[18:58:51.001124s] Tun device:           helium-test

Looking at the network devices I see the new helium-test however the state is incomplete. 

> 7: helium-test: <POINTOPOINT,MULTICAST,NOARP> mtu 1500 qdisc noop state DOWN group default qlen 500
    link/none 

With the interface never going active no route is ever installed in the route table on the server pointing towards the client. 

When trying to ping from the client to the server expected IP: 

> [19:02:16.711474s] Error writing to TUN device[19:02:17.717433s] Error writing to TUN device[19:02:18.741458s] Error writing to TUN device[19:02:19.765450s] Error writing to TUN device[19:02:20.790663s] Error writing to TUN device[19:02:21.813424s] Error writing to TUN device[19:02:22.837489s] Error writing to TUN device[19:02:23.861464s] Error writing to TUN device^C

Each ICMP packet causing a error writing to Tun.  

TCPDUMP on the server shows the incoming packet:

> [root@wolfssl-02 ~]# tcpdump host 192.168.0.48
dropped privs to tcpdump
tcpdump: verbose output suppressed, use -v or -vv for full protocol decode
listening on ens192, link-type EN10MB (Ethernet), capture size 262144 bytes
19:02:40.245486 IP 192.168.0.48.46886 > wolfssl-02.19655: UDP, length 140
19:02:40.245534 IP wolfssl-02 > 192.168.0.48: ICMP wolfssl-02 udp port 19655 unreachable, length 176
19:02:41.269365 IP 192.168.0.48.46886 > wolfssl-02.19655: UDP, length 140
19:02:41.269417 IP wolfssl-02 > 192.168.0.48: ICMP wolfssl-02 udp port 19655 unreachable, length 176
19:02:42.293458 IP 192.168.0.48.46886 > wolfssl-02.19655: UDP, length 140
19:02:42.293513 IP wolfssl-02 > 192.168.0.48: ICMP wolfssl-02 udp port 19655 unreachable, length 176
19:02:43.317359 IP 192.168.0.48.46886 > wolfssl-02.19655: UDP, length 140
19:02:43.317404 IP wolfssl-02 > 192.168.0.48: ICMP wolfssl-02 udp port 19655 unreachable, length 176
19:02:43.591793 ARP, Request who-has 192.168.0.48 tell wolfssl-02, length 28

From the above the Tun looks established from the Client to the Server but the Server doesn't have a valid route to respond back to the client using the Tun which never goes up.

## Possible Solution
None found.

## Steps to Reproduce (for bugs)
1. Fresh Centos 8 fully patched
2. Fresh pull of wolfssl
3. Fresh pull of lightway-laser
4. gcc, autoconf, automake, libtool, gem, ceedling, git, docker

> 5291800 Sep 23 16:51 lw.out

## Context
Attempting benchmark lightway across several platforms for analysis.  Currently can't run do to server functionality issue. 

## Your Environment

* Version used:
> https://github.com/expressvpn/lightway-laser
* Operating System and version:
> CentOS Linux release 8.4.2105

**Comment by expressvpn-david-wf** [comment]
Also just followed up and realised that I had fixed the documentation in [PR #1](https://github.com/expressvpn/lightway-laser/pull/1/files) but it hadn't been approved or merged yet, mea culpa for not following up there.

**Comment by light-brite** [comment]
@expressvpn-david-wf

Brilliant!  Precisely this.  I'll blame some of my ignorance on this too, as I had read the comment regardless of the approval, but I didn't put 2+2 together.  

With laser are there any other knobs that are available especially should a user want to utilize a different encryption scheme?  I say this because of the interesting things to me is the ability to get AES on equipment that actually has AES-NI available and hopefully drive core utilization down a bit.  I didn't see too many knobs or config files for doing any type of swap so was mostly just curious. 

Getting decent rates: 

Hardware: (It's a bit long in the tooth)
> [sdsmith@wolfssl-01 ~]$ more /proc/cpuinfo 
processor       : 0
vendor_id       : GenuineIntel
cpu family      : 6
model           : 62
model name      : Intel(R) Xeon(R) CPU E5-2680 v2 @ 2.80GHz
stepping        : 4
microcode       : 0x42e
cpu MHz         : 2800.000
cache size      : 25600 KB
physical id     : 0
siblings        : 1
core id         : 0
cpu cores       : 1
apicid          : 0
initial apicid  : 0
fpu             : yes
fpu_exception   : yes
cpuid level     : 13
wp              : yes
flags           : fpu vme de pse tsc msr pae mce cx8 apic sep mtrr pge mca cmov pat pse36 clflush mmx fxsr sse sse2
 ss syscall nx rdtscp lm constant_tsc arch_perfmon nopl xtopology tsc_reliable nonstop_tsc cpuid pni pclmulqdq ssse
3 cx16 pcid sse4_1 sse4_2 x2apic popcnt tsc_deadline_timer aes xsave avx f16c rdrand hypervisor lahf_lm cpuid_fault
 pti ssbd ibrs ibpb stibp fsgsbase tsc_adjust smep arat md_clear flush_l1d arch_capabilities
bugs            : cpu_meltdown spectre_v1 spectre_v2 spec_store_bypass l1tf mds swapgs itlb_multihit
bogomips        : 5600.00
clflush size    : 64
cache_alignment : 64
address sizes   : 43 bits physical, 48 bits virtual
power management:

Data Rates:  TCP

> [ ID] Interval           Transfer     Bitrate         Retr
[  5]   0.00-120.00 sec  6.49 GBytes   464 Mbits/sec  1310             sender
[  5]   0.00-120.04 sec  6.49 GBytes   464 Mbits/sec                  receiver

Doesn't appear at first glance to be thread limited running about 60% of a core for a flow.  

Data Rates: UDP

100M
> [ ID] Interval           Transfer     Bitrate         Jitter    Lost/Total Datagrams
[  5]   0.00-13.00  sec   162 MBytes   105 Mbits/sec  0.013 ms  0/130895 (0%)  receiver

200M
> [ ID] Interval           Transfer     Bitrate         Jitter    Lost/Total Datagrams
[  5]   0.00-10.04  sec   238 MBytes   199 Mbits/sec  0.011 ms  0/192590 (0%)  receiver

300M
> [ ID] Interval           Transfer     Bitrate         Jitter    Lost/Total Datagrams
[  5]   0.00-10.04  sec   358 MBytes   299 Mbits/sec  0.013 ms  0/288883 (0%)  receiver

400M
> [ ID] Interval           Transfer     Bitrate         Jitter    Lost/Total Datagrams
[  5]   0.00-10.04  sec   477 MBytes   398 Mbits/sec  0.014 ms  0/385179 (0%)  receiver

500M
> [ ID] Interval           Transfer     Bitrate         Jitter    Lost/Total Datagrams
[  5]   0.00-10.04  sec   596 MBytes   498 Mbits/sec  0.011 ms  0/481475 (0%)  receiver

Looks like after 500M things for UDP go a bit off the rails, but hey it's an older hardware stack and I'm just doing some preliminary testing.  

Thank you for your assistance.

**Comment by expressvpn-pete-m** [comment]
Hi @light-brite,

First, thanks for sharing your performance data, it's much appreciated! :)

Lightway Core itself supports either `AES-256` or `CHACHA20` with `AES-256` being the default. It doesn't look like `laser` currently supports switching to `CHACHA20`. If you'd be interested in testing that, we can look at getting that feature added. For the most part (at least on newer hardware) if you have `AES-NI` then `AES-256` outperforms `CHACHA20` in performance and CPU usage. For your CPU though, it might be different so that could be interesting to test. You can tweak `laser` to test this by using this function before connecting:

    he_ssl_ctx_set_use_chacha20(state->he_ctx);

I'll try to get you an example for this, so it'll be easier to test.

Our Linux 64 bit build configuration for WolfSSL does enable `AES-NI` [1] so it should be using it already if it's available on your CPU (which it is). If you're seeing CPU utilisation at 60% for ` laser` (I'm not sure if you were saying it was 60% for `laser` or for each `iperf` flow), then that would suggest you're getting bottlenecked elsewhere. Any chance you could also capture the percentage spent in kernel? We've found a lot of time is spent (particularly due to spectre mitigations) transitioning to and from kernel space in the `tun` driver. Might be worth a look :)

[1] https://github.com/expressvpn/lightway-core/blob/main/linux.yml#L21 (WolfSSL build config)

**Comment by light-brite** [comment]
Hello @expressvpn-pete-m,

It's my pleasure to try it out!  And I'm happy to help out as much as I can.  Granted I'll be the first to tell you the whole code thing is not my jam, so go easy on me please.  I'm more of an integration test type guy.  

For the current testing, it would be pretty interesting to see how AES and CHACHA20 would directly compare but then again numerous folks have done testing to indicate that where AES-NI is available it's often best to use AES.  I'm also looking for something that is relatively turn-key (My lack of programming skills) where I can establish a light-weight tunnel ideally within containers and inherit FIPS compliance.  

I'm attaching a screen shot: 
![wolf-lightway-cpu-utilization](https://user-images.githubusercontent.com/91293305/134906255-6e5700a0-33ed-458a-bb81-ca3e156c5cb5.png)

The server is definitely thread(Bottom in the screenshot) limited.  Right at about 490Mb/s of TCP I see significant retrans happening within Iperf3, and that correlates to the server being 97% for the lw thread. 

I expect quite a difference in performance between the two solutions just from user space vs kernel so not sure how well they compare directly.  However for your reference here are my numbers on similar VMs on the same hardware for Wireguard. 

sysctl settings: (Consistent across all my testing)

> net.core.rmem_default = 256000000
net.core.rmem_max = 456000000
net.ipv4.tcp_rmem = 65535       384000  8192000
net.ipv4.udp_rmem_min = 65535


iperf3
> - - - - - - - - - - - - - - - - - - - - - - - - -
[ ID] Interval           Transfer     Bitrate         Retr
[  5]   0.00-120.00 sec  43.1 GBytes  3.09 Gbits/sec  188             sender
[  5]   0.00-120.04 sec  43.1 GBytes  3.09 Gbits/sec                  receiver

![wireguard-cpu-utilization](https://user-images.githubusercontent.com/91293305/134914210-04afd296-830e-4312-8d20-2701166c890f.png)

Attaching a wireguard utilization as well for your reference.  

As you see iperf3 is not thread limited in either test between lw, or wireguard.  

Have you guys got some public numbers you've advertised regarding performance?  I have a stack of new Dell AMD's as well as the new Intel chips coming in, so I'll re-test again as I can. 

Thanks!

**Comment by light-brite** [comment]
@expressvpn-pete-m 

I'm going to close this issue to avoid scope creep, and keep things clean. 

Thank you for your assistance on the server side script knowledge transfer.
